{
  "plan_date": "2026-05-13",
  "issued_date": "2026-05-12",
  "issued_by": "Nirmal Mishra",
  "issued_role": "IODS Operations Supervisor (Offshore Project), HPM",
  "subject": "Vessel Movement Plan for the next 48 Hrs. 13-May-2026",
  "narrative": "All,\n\nPlease see the below Vessel Movement plan for next 48hrs.:\n\n\nAllianz Juno...\n\n\n\n  *   Vessel Currently STBY at North Port. Vessel will remain STBY at North Port.\n  *   Tomorrow 13th May, Vessel will sail 1st Trip to Rig Oriental Dragon-1 with KOC Crew Change Pax, ETD from Shuaiba Port at 06.00hrs. Vessel will return to Shuaiba Port Via North Port.\n  *   Tomorrow 13th May, Vessel will sail 2nd Run to Rig Oriental Phoenix with food containers & Crew Change Pax, ETD 11.00hrs., Vessel will return to Shuaiba Port via North Port & STBY at Shuaiba Port.\n\n\n\n Crest Argus 1...\n\n\n\n  *   Vessel currently STBY at Shuaiba Port, Vessel will remain STBY at Oriental Dragon-1.\n  *   Tomorrow 14th May, Vessel will sail to Oriental Dragon-1, ETD 16.00 Hrs.\n\n\nCrest Argus 3...\n\n\n\n  *   Vessel Currently STBY at Rig Oriental Phoenix, Vessel will remain STBY at Oriental Phoenix.\n  *   Tomorrow 13th May, Vessel will remain STBY at Oriental Phoenix.\n\n\n\nCrest Argus 5....\n\n\n\n  *   Vessel Currently STBY at Oriental Dragon-1, Vessel will remain STBY at Oriental Dragon-1.\n  *   Tomorrow 13th May, Vessel will sail to Shuaiba Port, ETD 19.00hrs.\n\n\n\nCrew change details will be sent by Rig Logistics/ Aisha/ Ahmed Modather.\n\n\n\nGary,\n\nKindly approve the above Vessel Movement Plan.\n\nRegards,\n\nNirmal Mishra\nIODS Operations Supervisor (Offshore Project), HPM\nKGL Logistics Area\nMina Abdullah 65200 Kuwait\nNirmal.Mishra@halliburton.com<mailto:Nirmal.Mishra@halliburton.com>\nM: 96569974782/ 96565946120\n[Halliburton]<https://urldefense.com/v3/__https://www.halliburton.com/__;!!KCsm8J4!Gfa_NmB2RCpBIlwKrHB1luwCtZ60Rgi4F8EsRmLYtfiothyY2oQmVGZiXo2cn_GC3Aby5O2MXW6FWTBfBuoiJAa5U5QK$ >\nLinkedIn<https://urldefense.com/v3/__https://www.linkedin.com/company/halliburton__;!!KCsm8J4!Gfa_NmB2RCpBIlwKrHB1luwCtZ60Rgi4F8EsRmLYtfiothyY2oQmVGZiXo2cn_GC3Aby5O2MXW6FWTBfBuoiJAeBbcst$ > | Instagram<https://urldefense.com/v3/__https://www.instagram.com/halliburton__;!!KCsm8J4!Gfa_NmB2RCpBIlwKrHB1luwCtZ60Rgi4F8EsRmLYtfiothyY2oQmVGZiXo2cn_GC3Aby5O2MXW6FWTBfBuoiJDAe5Ppt$ > | YouTube<https://urldefense.com/v3/__https://www.youtube.com/halliburton__;!!KCsm8J4!Gfa_NmB2RCpBIlwKrHB1luwCtZ60Rgi4F8EsRmLYtfiothyY2oQmVGZiXo2cn_GC3Aby5O2MXW6FWTBfBuoiJAmIrYuH$ > | Facebook<https://urldefense.com/v3/__https://www.facebook.com/halliburton__;!!KCsm8J4!Gfa_NmB2RCpBIlwKrHB1luwCtZ60Rgi4F8EsRmLYtfiothyY2oQmVGZiXo2cn_GC3Aby5O2MXW6FWTBfBuoiJEzY-dnb$ >\n\nThis e-mail, including any attached files, may contain confidential and privileged information for the sole use of the intended recipient. Any review, use, distribution, or disclosure by others is strictly prohibited. If you are not the intended recipient (or authorized to receive information for the intended recipient), please contact the sender by reply e-mail and delete all copies of this message.",
  "vessels": [
    {
      "vessel_id": "JUNO",
      "current_status": "Vessel Currently STBY at North Port. Vessel will remain STBY at North Port.",
      "tomorrow_plan": "Tomorrow 13th May, Vessel will sail 1st Trip to Rig Oriental Dragon-1 with KOC Crew Change Pax, ETD from Shuaiba Port at 06.00hrs. Vessel will return to Shuaiba Port Via North Port.",
      "additional": "Tomorrow 13th May, Vessel will sail 2nd Run to Rig Oriental Phoenix with food containers & Crew Change Pax, ETD 11.00hrs., Vessel will return to Shuaiba Port via North Port & STBY at Shuaiba Port."
    },
    {
      "vessel_id": "CA1",
      "current_status": "Vessel currently STBY at Shuaiba Port, Vessel will remain STBY at Oriental Dragon-1.",
      "tomorrow_plan": "Tomorrow 14th May, Vessel will sail to Oriental Dragon-1, ETD 16.00 Hrs.",
      "additional": ""
    },
    {
      "vessel_id": "CA3",
      "current_status": "Vessel Currently STBY at Rig Oriental Phoenix, Vessel will remain STBY at Oriental Phoenix.",
      "tomorrow_plan": "Tomorrow 13th May, Vessel will remain STBY at Oriental Phoenix.",
      "additional": ""
    },
    {
      "vessel_id": "CA5",
      "current_status": "Vessel Currently STBY at Oriental Dragon-1, Vessel will remain STBY at Oriental Dragon-1.",
      "tomorrow_plan": "Tomorrow 13th May, Vessel will sail to Shuaiba Port, ETD 19.00hrs.",
      "additional": ""
    }
  ],
  "source": {
    "type": "imported_email",
    "email_subject": "Vessel Movement Plan for the next 48 Hrs. 13-May-2026",
    "email_from": "Nirmal Mishra <Nirmal.Mishra@halliburton.com>",
    "email_date": "2026-05-12T15:39:34+00:00",
    "submitted_via": "historical_import"
  }
}