{
  "plan_date": "2026-05-11",
  "issued_date": "2026-05-11",
  "issued_by": "Nirmal Mishra",
  "issued_role": "IODS Operations Supervisor (Offshore Project), HPM",
  "subject": "Vessel Movement Plan for the next 48 Hrs. 11-May-2026",
  "narrative": "All,\n\nPlease see the below Vessel Movement plan for next 48hrs.:\n\n\nAllianz Juno…\n\n\n\n  *   Vessel Currently STBY at Shuaiba Port. Vessel will remain STBY at Shuaiba Port.\n  *   Tomorrow 12th May, Vessel will sail 1st Trip to Rig Oriental Dragon-1 via NSBP with COSL Crew Change Pax, ETD from Shuaiba Port at 07.30hrs.\n  *   Tomorrow 12th May, Vessel will sail 2nd Run to Rig Oriental Phoenix with cargo, ETD 13.00hrs., Vessel will return to Shuaiba Port & STBY at Shuaiba Port.\n\n\n\n Crest Argus 1…\n\n\n\n  *   Vessel currently STBY at Rig Oriental Dragon-1, Vessel will remain STBY at Oriental Dragon-1.\n  *   Tomorrow 12th May, Vessel will sail to Shuaiba Port, ETD 14.00 Hrs.\n\n\nCrest Argus 3…\n\n\n\n  *   Vessel Currently STBY at Rig Oriental Phoenix, Vessel will remain STBY at Oriental Phoenix.\n  *   Tomorrow 12th May, Vessel will remain STBY at Oriental Phoenix.\n\n\n\nCrest Argus 5….\n\n\n\n  *   Vessel Currently STBY at Shuaiba Port, Vessel will remain STBY at Shuaiba Port.\n  *   Tomorrow 12th May, Vessel will sail to Rig Oriental Dragon-1, ETD 10.00hrs.\n\n\n\nCrew change details will be sent by Rig Logistics/ Aisha/ Ahmed Modather.\n\n\n\nGary,\n\nKindly approve the above Vessel Movement Plan.\n\nRegards,\n\nNirmal Mishra\nIODS Operations Supervisor (Offshore Project), HPM\nKGL Logistics Area\nMina Abdullah 65200 Kuwait\nNirmal.Mishra@halliburton.com<mailto:Nirmal.Mishra@halliburton.com>\nM: 96569974782/ 96565946120\n[Halliburton]<https://urldefense.com/v3/__https://www.halliburton.com/__;!!KCsm8J4!HEaejOPh1hi_jGz3xfoylLuSgVy9Jrg0xkog8PGmxqtYB7dtrFB3vBxkgpYnZG4OIbDEPzdmFxVIk5zG4KXKXMyhbntQ$ >\nLinkedIn<https://urldefense.com/v3/__https://www.linkedin.com/company/halliburton__;!!KCsm8J4!HEaejOPh1hi_jGz3xfoylLuSgVy9Jrg0xkog8PGmxqtYB7dtrFB3vBxkgpYnZG4OIbDEPzdmFxVIk5zG4KXKXI-WsOFe$ > | Instagram<https://urldefense.com/v3/__https://www.instagram.com/halliburton__;!!KCsm8J4!HEaejOPh1hi_jGz3xfoylLuSgVy9Jrg0xkog8PGmxqtYB7dtrFB3vBxkgpYnZG4OIbDEPzdmFxVIk5zG4KXKXFgjuI-v$ > | YouTube<https://urldefense.com/v3/__https://www.youtube.com/halliburton__;!!KCsm8J4!HEaejOPh1hi_jGz3xfoylLuSgVy9Jrg0xkog8PGmxqtYB7dtrFB3vBxkgpYnZG4OIbDEPzdmFxVIk5zG4KXKXInz7nNU$ > | Facebook<https://urldefense.com/v3/__https://www.facebook.com/halliburton__;!!KCsm8J4!HEaejOPh1hi_jGz3xfoylLuSgVy9Jrg0xkog8PGmxqtYB7dtrFB3vBxkgpYnZG4OIbDEPzdmFxVIk5zG4KXKXE7ee5qf$ >\n\nThis e-mail, including any attached files, may contain confidential and privileged information for the sole use of the intended recipient. Any review, use, distribution, or disclosure by others is strictly prohibited. If you are not the intended recipient (or authorized to receive information for the intended recipient), please contact the sender by reply e-mail and delete all copies of this message.",
  "vessels": [
    {
      "vessel_id": "JUNO",
      "current_status": "Vessel Currently STBY at Shuaiba Port. Vessel will remain STBY at Shuaiba Port.",
      "tomorrow_plan": "Tomorrow 12th May, Vessel will sail 1st Trip to Rig Oriental Dragon-1 via NSBP with COSL Crew Change Pax, ETD from Shuaiba Port at 07.30hrs.",
      "additional": "Tomorrow 12th May, Vessel will sail 2nd Run to Rig Oriental Phoenix with cargo, ETD 13.00hrs., Vessel will return to Shuaiba Port & STBY at Shuaiba Port."
    },
    {
      "vessel_id": "CA1",
      "current_status": "Vessel currently STBY at Rig Oriental Dragon-1, Vessel will remain STBY at Oriental Dragon-1.",
      "tomorrow_plan": "Tomorrow 12th May, Vessel will sail to Shuaiba Port, ETD 14.00 Hrs.",
      "additional": ""
    },
    {
      "vessel_id": "CA3",
      "current_status": "Vessel Currently STBY at Rig Oriental Phoenix, Vessel will remain STBY at Oriental Phoenix.",
      "tomorrow_plan": "Tomorrow 12th May, Vessel will remain STBY at Oriental Phoenix.",
      "additional": ""
    },
    {
      "vessel_id": "CA5",
      "current_status": "Vessel Currently STBY at Shuaiba Port, Vessel will remain STBY at Shuaiba Port.",
      "tomorrow_plan": "Tomorrow 12th May, Vessel will sail to Rig Oriental Dragon-1, ETD 10.00hrs.",
      "additional": ""
    }
  ],
  "source": {
    "type": "imported_email",
    "email_subject": "Vessel Movement Plan for the next 48 Hrs. 11-May-2026",
    "email_from": "Nirmal Mishra <Nirmal.Mishra@halliburton.com>",
    "email_date": "2026-05-11T15:10:50+00:00",
    "submitted_via": "historical_import"
  }
}