{
  "plan_date": "2026-05-08",
  "issued_date": "2026-05-07",
  "issued_by": "Nirmal Mishra",
  "issued_role": "IODS Operations Supervisor (Offshore Project), HPM",
  "subject": "Vessel Movement Plan for the next 48 Hrs. 08-May-2026",
  "narrative": "All,\n\nPlease see the below Vessel Movement plan for next 48hrs.:\n\n\nAllianz Juno…\n\n\n\n  *   Vessel Currently enroute to Shuaiba Port from Rig OPH, ETA at 19.10 hrs., Vessel will remain STBY at Shuaiba Port.\n  *   Tomorrow 8th May, Vessel will sail to Rig Oriental Phoenix via NSBP & Rig Oriental Dragon-1, ETD 08.00hrs.\n  *   Vessel will return to Shuaiba Port from Rig OPH, Vessel will STBY.\n\n\n\n Crest Argus 1…\n\n\n\n  *   Vessel currently STBY at Rig Oriental Dragon-1, Vessel will remain STBY at Oriental Dragon-1.\n  *   Tomorrow 8th May, Vessel will remain STBY at Rig Oriental Dragon-1.\n\n\nCrest Argus 3…\n\n\n\n  *   Vessel STBY at Shuaiba Port, Vessel will remain STBY at Shuaiba Port.\n  *   Tomorrow 8th May, Vessel will sail to Oriental Phoenix, ETD TBC.\n\n\n\nCrest Argus 5….\n\n\n\n  *   Vessel Currently STBY at Rig Oriental Phoenix, Vessel will remain STBY at Oriental Phoenix.\n  *   Tomorrow 8th May, Vessel will remain STBY at Oriental Phoenix.\n\n\n\nCrew change details will be sent by Rig Logistics/ Aisha/ Ahmed Modather.\n\n\n\nGary,\n\nKindly approve the above Vessel Movement Plan.\n\nRegards,\n\nNirmal Mishra\nIODS Operations Supervisor (Offshore Project), HPM\nKGL Logistics Area\nMina Abdullah 65200 Kuwait\nNirmal.Mishra@halliburton.com<mailto:Nirmal.Mishra@halliburton.com>\nM: 96569974782/ 96565946120\n[Halliburton]<https://urldefense.com/v3/__https://www.halliburton.com/__;!!KCsm8J4!E_6DUFZUw1hFVDUFnzzm7k4EYpwLWUFQ5abzyhUBg0Txs4ZsJngnRd8Mhyz59_S4y8fCFm1UwyEwzkihD1cgzyomg_WG$ >\nLinkedIn<https://urldefense.com/v3/__https://www.linkedin.com/company/halliburton__;!!KCsm8J4!E_6DUFZUw1hFVDUFnzzm7k4EYpwLWUFQ5abzyhUBg0Txs4ZsJngnRd8Mhyz59_S4y8fCFm1UwyEwzkihD1cgz8RyT7vj$ > | Instagram<https://urldefense.com/v3/__https://www.instagram.com/halliburton__;!!KCsm8J4!E_6DUFZUw1hFVDUFnzzm7k4EYpwLWUFQ5abzyhUBg0Txs4ZsJngnRd8Mhyz59_S4y8fCFm1UwyEwzkihD1cgz0HIow2z$ > | YouTube<https://urldefense.com/v3/__https://www.youtube.com/halliburton__;!!KCsm8J4!E_6DUFZUw1hFVDUFnzzm7k4EYpwLWUFQ5abzyhUBg0Txs4ZsJngnRd8Mhyz59_S4y8fCFm1UwyEwzkihD1cgz7Y3CaTj$ > | Facebook<https://urldefense.com/v3/__https://www.facebook.com/halliburton__;!!KCsm8J4!E_6DUFZUw1hFVDUFnzzm7k4EYpwLWUFQ5abzyhUBg0Txs4ZsJngnRd8Mhyz59_S4y8fCFm1UwyEwzkihD1cgz8lnSp_7$ >\n\nThis e-mail, including any attached files, may contain confidential and privileged information for the sole use of the intended recipient. Any review, use, distribution, or disclosure by others is strictly prohibited. If you are not the intended recipient (or authorized to receive information for the intended recipient), please contact the sender by reply e-mail and delete all copies of this message.",
  "vessels": [
    {
      "vessel_id": "JUNO",
      "current_status": "Vessel Currently enroute to Shuaiba Port from Rig OPH, ETA at 19.10 hrs., Vessel will remain STBY at Shuaiba Port.",
      "tomorrow_plan": "Tomorrow 8th May, Vessel will sail to Rig Oriental Phoenix via NSBP & Rig Oriental Dragon-1, ETD 08.00hrs.",
      "additional": "Vessel will return to Shuaiba Port from Rig OPH, Vessel will STBY."
    },
    {
      "vessel_id": "CA1",
      "current_status": "Vessel currently STBY at Rig Oriental Dragon-1, Vessel will remain STBY at Oriental Dragon-1.",
      "tomorrow_plan": "Tomorrow 8th May, Vessel will remain STBY at Rig Oriental Dragon-1.",
      "additional": ""
    },
    {
      "vessel_id": "CA3",
      "current_status": "Vessel STBY at Shuaiba Port, Vessel will remain STBY at Shuaiba Port.",
      "tomorrow_plan": "Tomorrow 8th May, Vessel will sail to Oriental Phoenix, ETD TBC.",
      "additional": ""
    },
    {
      "vessel_id": "CA5",
      "current_status": "Vessel Currently STBY at Rig Oriental Phoenix, Vessel will remain STBY at Oriental Phoenix.",
      "tomorrow_plan": "Tomorrow 8th May, Vessel will remain STBY at Oriental Phoenix.",
      "additional": ""
    }
  ],
  "source": {
    "type": "imported_email",
    "email_subject": "Vessel Movement Plan for the next 48 Hrs. 08-May-2026",
    "email_from": "Nirmal Mishra <Nirmal.Mishra@halliburton.com>",
    "email_date": "2026-05-07T15:58:44+00:00",
    "submitted_via": "historical_import"
  }
}