{
  "plan_date": "2026-05-09",
  "issued_date": "2026-05-08",
  "issued_by": "Nirmal Mishra",
  "issued_role": "IODS Operations Supervisor (Offshore Project), HPM",
  "subject": "Vessel Movement Plan for the next 48 Hrs. 09-May-2026",
  "narrative": "All,\n\nPlease see the below Vessel Movement plan for next 48hrs.:\n\n\nAllianz Juno…\n\n\n\n  *   Vessel Currently STBY at Shuaiba Port. Vessel will remain STBY at Shuaiba Port.\n  *   Tomorrow 9th May, Vessel will sail to Rig Oriental Dragon via NSBP & Rig Oriental Phoenix with Crew change pax, ETD 07.30hrs.\n  *   Vessel will return to Shuaiba Port from Rig Oriental Dragon via NSBP, Vessel will STBY at Berth-4.\n\n\n\n Crest Argus 1…\n\n\n\n  *   Vessel currently STBY at Rig Oriental Dragon-1, Vessel will remain STBY at Oriental Dragon-1.\n  *   Tomorrow 9th May, Vessel will remain STBY at Rig Oriental Dragon-1.\n\n\nCrest Argus 3…\n\n\n\n  *   Vessel enroute to Rig OPH, ETA at OPH 22.18hrs., Vessel will STBY at Rig Oriental Phoenix.\n  *   Tomorrow 9th May, Vessel will remain STBY at Rig Oriental Phoenix.\n\n\n\nCrest Argus 5….\n\n\n\n  *   Vessel Currently STBY at Rig Oriental Phoenix, Vessel will remain STBY at Oriental Phoenix.\n  *   Tomorrow 9th May, Vessel will sail to Shuaiba Port, ETD 16.00hrs.\n\n\n\nCrew change details will be sent by Rig Logistics/ Aisha/ Ahmed Modather.\n\n\n\nGary,\n\nKindly approve the above Vessel Movement Plan.\n\nRegards,\n\nNirmal Mishra\nIODS Operations Supervisor (Offshore Project), HPM\nKGL Logistics Area\nMina Abdullah 65200 Kuwait\nNirmal.Mishra@halliburton.com<mailto:Nirmal.Mishra@halliburton.com>\nM: 96569974782/ 96565946120\n[Halliburton]<https://urldefense.com/v3/__https://www.halliburton.com/__;!!KCsm8J4!CMw9WWftz9Na7uunonIO1szpn5dBlhgMQaJMnYTAJ-VXIkIXhTXs9gQf07glWgm3yg7LkWbJI0BAXTDZReI-dLWhMXfJ$ >\nLinkedIn<https://urldefense.com/v3/__https://www.linkedin.com/company/halliburton__;!!KCsm8J4!CMw9WWftz9Na7uunonIO1szpn5dBlhgMQaJMnYTAJ-VXIkIXhTXs9gQf07glWgm3yg7LkWbJI0BAXTDZReI-dBsymFIY$ > | Instagram<https://urldefense.com/v3/__https://www.instagram.com/halliburton__;!!KCsm8J4!CMw9WWftz9Na7uunonIO1szpn5dBlhgMQaJMnYTAJ-VXIkIXhTXs9gQf07glWgm3yg7LkWbJI0BAXTDZReI-dM5S8Obw$ > | YouTube<https://urldefense.com/v3/__https://www.youtube.com/halliburton__;!!KCsm8J4!CMw9WWftz9Na7uunonIO1szpn5dBlhgMQaJMnYTAJ-VXIkIXhTXs9gQf07glWgm3yg7LkWbJI0BAXTDZReI-dMJaiQ_Q$ > | Facebook<https://urldefense.com/v3/__https://www.facebook.com/halliburton__;!!KCsm8J4!CMw9WWftz9Na7uunonIO1szpn5dBlhgMQaJMnYTAJ-VXIkIXhTXs9gQf07glWgm3yg7LkWbJI0BAXTDZReI-dJ-Abzh6$ >\n\nThis e-mail, including any attached files, may contain confidential and privileged information for the sole use of the intended recipient. Any review, use, distribution, or disclosure by others is strictly prohibited. If you are not the intended recipient (or authorized to receive information for the intended recipient), please contact the sender by reply e-mail and delete all copies of this message.",
  "vessels": [
    {
      "vessel_id": "JUNO",
      "current_status": "Vessel Currently STBY at Shuaiba Port. Vessel will remain STBY at Shuaiba Port.",
      "tomorrow_plan": "Tomorrow 9th May, Vessel will sail to Rig Oriental Dragon via NSBP & Rig Oriental Phoenix with Crew change pax, ETD 07.30hrs.",
      "additional": "Vessel will return to Shuaiba Port from Rig Oriental Dragon via NSBP, Vessel will STBY at Berth-4."
    },
    {
      "vessel_id": "CA1",
      "current_status": "Vessel currently STBY at Rig Oriental Dragon-1, Vessel will remain STBY at Oriental Dragon-1.",
      "tomorrow_plan": "Tomorrow 9th May, Vessel will remain STBY at Rig Oriental Dragon-1.",
      "additional": ""
    },
    {
      "vessel_id": "CA3",
      "current_status": "Vessel enroute to Rig OPH, ETA at OPH 22.18hrs., Vessel will STBY at Rig Oriental Phoenix.",
      "tomorrow_plan": "Tomorrow 9th May, Vessel will remain STBY at Rig Oriental Phoenix.",
      "additional": ""
    },
    {
      "vessel_id": "CA5",
      "current_status": "Vessel Currently STBY at Rig Oriental Phoenix, Vessel will remain STBY at Oriental Phoenix.",
      "tomorrow_plan": "Tomorrow 9th May, Vessel will sail to Shuaiba Port, ETD 16.00hrs.",
      "additional": ""
    }
  ],
  "source": {
    "type": "imported_email",
    "email_subject": "Vessel Movement Plan for the next 48 Hrs. 09-May-2026",
    "email_from": "Nirmal Mishra <Nirmal.Mishra@halliburton.com>",
    "email_date": "2026-05-08T15:27:05+00:00",
    "submitted_via": "historical_import"
  }
}